{
  "schema": "gunnchos.middleware.identity.v1",
  "account_id": "acct-lab-student-001",
  "session_id": "sess-a1b2c3d4e5f60718",
  "device_id": "dev-student-14-5",
  "roles": ["user", "student"],
  "binding_state": "bound",
  "issued_at_utc": "2026-08-16T16:30:00Z",
  "expires_at_utc": null,
  "claim_boundary": "Software identity envelope for middleware contract tests. Not IdP/SSO/hardware credentials."
}
